{
  "schema_version": "1.0.0",
  "id": "model-request-local-structured-001",
  "project_id": "project-alpha",
  "capability": "structured_generation",
  "provider_preference": {
    "mode": "local_only",
    "provider": "local-llm",
    "model": "local-structured-small",
    "allow_remote": false,
    "config_version": 1
  },
  "payload": {
    "kind": "answer",
    "content": "根据召回证据回答用户问题，必须保留引用。",
    "input_refs": [
      {
        "kind": "recall_result",
        "object_id": "recall-result-project-alpha-001",
        "uri": "crp://default/recall/recall-result-project-alpha-001.json"
      }
    ],
    "source_refs": [
      {
        "source_id": "source-text-001",
        "locator": "char:0-80"
      }
    ],
    "recall_result_id": "recall-result-project-alpha-001"
  },
  "privacy": {
    "scope": "local_only",
    "pii": "none",
    "allow_remote": false,
    "redaction": {
      "applied": false,
      "strategy": "none"
    },
    "retention": "none"
  },
  "timeout": {
    "request_timeout_ms": 30000,
    "idle_timeout_ms": 10000,
    "deadline_at": "2026-06-29T16:00:00+08:00"
  },
  "cancel": {
    "cancellable": true,
    "cancel_token": "cancel-model-local-001",
    "requested": false
  },
  "budget": {
    "max_input_tokens": 12000,
    "max_output_tokens": 2000,
    "max_total_tokens": 14000,
    "max_cost_usd": 0
  },
  "response_schema": {
    "type": "json",
    "json_schema_uri": "crp://default/contracts/answers/answer.schema.json",
    "strict": true
  },
  "created_at": "2026-06-29T15:55:00+08:00"
}
